,concepts,type,Definition,process_name,DataProperty,synonyms
86, project documents,Has_Inputs,project documents that can be considered   resource calendars   the resource calendars inﬂuence the duration of schedule  activities due to the availability of speciﬁc resources type of resources and resources with speciﬁc attributes  resource calendars specify when and how long identiﬁed project resources will be available during the project  resource requirements   the estimated activity resource requirements will have  an effect on the duration of the activity since the level to which the resources assigned to the activity meet  the requirements will signiﬁcantly inﬂuence the duration of most activities for example if additional or lower skilled resources are assigned to an activity there may be reduced efﬁciency or productivity due to increased  communication training and coordination needs leading to a longer duration estimate  risk register   individual project risks may impact resource selection and  availability updates to the risk register are included with project documents updates    from plan risk responses, estimate activity durations,section 6.2.3.2,undertaking document 
87, enterprise environmental factors,Has_Inputs,the enterprise environmental factors that can inﬂuence the estimate activity durations process include but are not  limited to  duration estimating databases and other reference data  productivity metrics  published commercial information and  location of team members, estimate activity durations,,endeavor environmental factor 
88, organizational process assets,Has_Inputs,the organizational process assets that can inﬂuence the estimate activity durations process include but are not  limited to  historical duration information  project calendars  estimating policies  scheduling methodology and  lessons learned repository   durations can be quantitatively determined by multiplying the quantity of work to be performed by the number of labor  hours per unit of work for example duration on a design project is estimated by the number of drawings multiplied by  the number of labor hours per drawing or on a cable installation the meters of cable multiplied by the number of labor  hours per meter if the assigned resource is capable of installing  meters of cable per hour the duration required to  install  meters is  hours  meters divided by  meters per hour this technique can produce higher levels of accuracy depending on the sophistication and underlying data built into  the model parametric schedule estimates can be applied to a total project or to segments of a project in conjunction  with other estimating methods, estimate activity durations,,organisational procedure asset 
89, threepoint estimating,Has_Inputs,the accuracy of singlepoint duration estimates may be improved by considering estimation uncertainty and risk  using threepoint estimates helps deﬁne an approximate range for an activity’s duration  most likely tm this estimate is based on the duration of the activity given the resources likely to be assigned  their productivity realistic expectations of availability for the activity dependencies on other participants and  interruptions  optimistic to the activity duration based on analysis of the bestcase scenario for the activity  pessimistic tp the duration based on analysis of the worstcase scenario for the activity depending on the assumed distribution of values within the range of the three estimates the expected duration te  can be calculated one commonly used formula is triangular distribution te  to  tm  tp   triangular distribution is used when there is insufﬁcient historical data or when using judgmental data duration  estimates based on three points with an assumed distribution provide an expected duration and clarify the range of  uncertainty around the expected duration, estimate activity durations,,calculate 
90, bottomup estimating,Has_Inputs,bottomup estimating is a method of estimating project duration or cost by aggregating the estimates of the lower level components of the wbs when an activity’s duration cannot be estimated with a reasonable degree of conﬁdence  the work within the activity is decomposed into more detail the detail durations are estimated these estimates are  then aggregated into a total quantity for each of the activity’s durations activities may or may not have dependencies  between them that can affect the application and use of resources if there are dependencies this pattern of resource  usage is reﬂected and documented in the estimated requirements of the activity, estimate activity durations,,calculate 
91, data analysis,Has_Inputs,data analysis techniques that can be used for this process include but are not limited to  alternatives analysis alternatives analysis is used to compare various levels of resource capability or skills  scheduling compression techniques   different tools manual versus automated  and make rent or buy decisions regarding the resources this allows the team to weigh resource cost and  duration variables to determine an optimal approach for accomplishing project work  reserve analysis reserve analysis is used to determine the amount of contingency and management reserve  needed for the project duration estimates may include contingency reserves sometimes referred to as schedule  reserves to account for schedule uncertainty contingency reserves are the estimated duration within the schedule  baseline which is allocated for identiﬁed risks that are accepted contingency reserves are associated with the  knownunknowns which may be estimated to account for this unknown amount of rework the contingency  reserve may be a percentage of the estimated activity duration or a ﬁxed number of work periods contingency  reserves may be separated from the individual activities and aggregated as more precise information about the  project becomes available the contingency reserve may be used reduced or eliminated contingency should be  clearly identiﬁed in the schedule documentation estimates may also be produced for the amount of management reserve of schedule for the project management  reserves are a speciﬁed amount of the project budget withheld for management control purposes and are  reserved for unforeseen work that is within scope of the project management reserves are intended to address  the unknownunknowns that can affect a project management reserve is not included in the schedule baseline  but it is part of the overall project duration requirements depending on contract terms use of management  reserves may require a change to the schedule baseline, estimate activity durations,section 6.5.2.6,information psychoanalysis 
92, decision making,Has_Inputs,  decisionmaking techniques that can be used in this process include but are not limited  to voting one variation of the voting method that is often used in agilebased projects is called the ﬁst of ﬁve also called  ﬁst to ﬁve in this technique the project manager asks the team to show their level of support for a decision by holding  up a closed ﬁst indicating no support up to ﬁve ﬁngers indicating full support if a team member holds up fewer than  three ﬁngers the team member is given the opportunity to discuss any objections with the team the project manager  continues the ﬁstofﬁve process until the team achieves consensus everyone holds up three or more ﬁngers or agrees  to move on to the next decision, estimate activity durations,section 5.2.2.4,determination devising 
93, meetings,Has_Inputs,the project team may hold meetings to estimate activity durations when using an agile approach it is necessary  to conduct sprint or iteration planning meetings to discuss prioritized product backlog items user stories and decide  which of these items the team will commit to work on in the upcoming iteration the team breaks down user stories to  lowlevel tasks with estimates in hours and then validates that the estimates are achievable based on team capacity  over the duration iteration this meeting is usually held on the ﬁrst day of the iteration and is attended by the product  owner the scrum team and the project manager the outcome of the meeting includes an iteration backlog as well as  assumptions concerns risks dependencies decisions and actions, estimate activity durations,,meeting 
94, duration estimates,Has_Outputs,duration estimates are quantitative assessments of the likely number of time periods that are required to complete  an activity a phase or a project duration estimates do not include any lags as   duration  estimates may include some indication of the range of possible results for example  a range of  weeks ±  days which indicates that the activity will take at least  days and not more than   assuming a day work week or  a  probability of exceeding  weeks which indicates a high probability  that the activity will take   weeks or less, estimate activity durations,section 6.3.2.3,length estimate 
95, basis of estimates,Has_Outputs,the amount and type of additional details supporting the duration estimate vary by application area regardless of  the level of detail the supporting documentation should provide a clear and complete understanding of how the duration  estimate was derived supporting detail for duration estimates may include  documentation of the basis of the estimate ie how it was developed  documentation of all assumptions made  documentation of any known constraints  indication of the range of possible estimates eg ± to indicate that the duration is estimated between a  range of values  indication of the conﬁdence level of the ﬁnal estimate and  documentation of individual project risks inﬂuencing this estimate, estimate activity durations,,foundation estimate 
96, project documents updates,Has_Outputs,project documents that may be updated as a result of carrying out this process include but are not limited to  activity attributes   activity duration estimates produced during this process are  documented as part of the activity attributes  assumption log   this includes assumptions made in developing the duration  estimate such as resource skill levels and availability as well as a basis of estimates for durations additionally  constraints arising out of the scheduling methodology and scheduling tool are also documented  lessons learned register   the lessons learned register can be updated with  techniques that were efﬁcient and effective in developing effort and duration estimates    develop schedule develop schedule is the process of analyzing activity sequences durations resource requirements and schedule  constraints to create a schedule model for project execution and monitoring and controlling the key beneﬁt of this  process is that it generates a schedule model with planned dates for completing project activities this process  is performed throughout the project   figure  develop schedule data flow diagram developing an acceptable project schedule is an iterative process the schedule model is used to determine the  planned start and ﬁnish dates for project activities and milestones based on the best available information schedule  development can require the review and revision of duration estimates resource estimates and schedule reserves to  establish an approved project schedule that can serve as a baseline to track progress key steps include deﬁning the  project milestones identifying and sequencing activities and estimating durations once the activity start and ﬁnish  dates have been determined it is common to have the project staff assigned to the activities review their assigned  activities the staff conﬁrms that the start and ﬁnish dates present no conﬂict with resource calendars or assigned  activities on other projects or tasks and thus are still valid the schedule is then analyzed to determine conﬂicts with  logical relationships and if resource leveling is required before the schedule is approved and baselined revising and  maintaining the project schedule model to sustain a realistic schedule continues throughout the duration of the project  as   for more speciﬁc information regarding scheduling refer to the practice standard for scheduling, estimate activity durations,section 6.2.3.2,undertaking document update 
97, project management plan,Has_Inputs,  project management plan components include but are not limited to  schedule management plan   the schedule management plan identiﬁes the  scheduling method and tool used to create the schedule and how the schedule is to be calculated  scope baseline   the scope statement wbs and wbs dictionary have details about  the project deliverables that are considered when building the schedule model, develop schedule,section 4.2.3.1,undertaking direction program 
98, project documents,Has_Inputs,project documents that can be considered    basis of estimates   the amount and type of additional details supporting the  duration estimate vary by application area regardless of the level of detail the supporting documentation should  provide a clear and complete understanding of how the duration estimate was derived  duration estimates   the duration estimates contain the quantitative assessments  of the likely number of work periods that will be required to complete an activity this will be used to calculate  the schedule  lessons learned   lessons learned earlier in the project with regard to developing  the schedule model can be applied to later phases in the project to improve the validity of the schedule model  milestone list   the milestone list has scheduled dates for speciﬁc milestones  project schedule network diagrams   the project schedule network diagrams  contain the logical relationships of predecessors and successors that will be used to calculate the schedule  project team assignments   the project team assignments specify which resources  are assigned to each activity  resource calendars s  the resource calendars contain information on the  availability of resources during the project  resource requirements   the activity resource requirements identify the types and  quantities of resources required for each activity used to create the schedule model  risk register   the risk register provides the details of all identiﬁed risks and their  characteristics that affect the schedule model risk information relevant to the schedule is reﬂected in schedule  reserves using the expected or mean risk impact, develop schedule,section 6.2.3.2,undertaking document 
99, agreements,Has_Inputs,  vendors may have an input to the project schedule as they develop the details of how  they will perform the project work to meet contractual commitments, develop schedule,section 12.2.3.2,agreement 
100, enterprise environmental factors,Has_Inputs,the enterprise environmental factors that can inﬂuence the develop schedule process include but are not limited to  government or industry standards and  communication channels, develop schedule,,endeavor environmental factor 
101, organizational process assets,Has_Inputs,the organizational process assets that can inﬂuence the develop schedule process include but are not limited to  scheduling methodology containing the policies governing schedule model development and maintenance  and  project calendars, develop schedule,,organisational procedure asset 
102, schedule network analysis,Has_Technics_Tools,schedule network analysis is the overarching technique used to generate the project schedule model it employs  several other techniques such as critical path method   resource optimization techniques    and modeling techniques   additional analysis includes but  is not limited to  assessing the need to aggregate schedule reserves to reduce the probability of a schedule slip when multiple  paths converge at a single point in time or when multiple paths diverge from a single point in time to reduce the  probability of a schedule slip  reviewing the network to see if the critical path has highrisk activities or long lead items that would necessitate  use of schedule reserves or the implementation of risk responses to reduce the risk on the critical path schedule network analysis is an iterative process that is employed until a viable schedule model is developed, develop schedule,section 6.5.2.2,agenda mesh psychoanalysis 
103, critical path method,Has_Technics_Tools,the critical path method is used to estimate the minimum project duration and determine the amount of schedule  ﬂexibility on the logical network paths within the schedule model this schedule network analysis technique calculates  the early start early ﬁnish late start and late ﬁnish dates for all activities without regard for any resource limitations  by performing a forward and backward pass analysis through the schedule network as shown in figure  in this  example the longest path includes activities a c and d and therefore the sequence of acd is the critical path  the critical path is the sequence of activities that represents the longest path through a project which determines  the shortest possible project duration the longest path has the least total ﬂoat usually zero the resulting early  and late start and ﬁnish dates are not necessarily the project schedule rather they indicate the time periods within  which the activity could be executed using the parameters entered in the schedule model for activity durations logical  relationships leads lags and other known constraints the critical path method is used to calculate the critical paths  and the amount of total and free ﬂoat or schedule ﬂexibility on the logical network paths within the schedule model on any network path the total ﬂoat or schedule ﬂexibility is measured by the amount of time that a schedule  activity can be delayed or extended from its early start date without delaying the project ﬁnish date or violating a  schedule constraint a critical path is normally characterized by zero total ﬂoat on the critical path as implemented  with the precedence diagramming method sequencing critical paths may have positive zero or negative total ﬂoat  depending on the constraints applied positive total ﬂoat is caused when the backward pass is calculated from a  schedule constraint that is later than the early ﬁnish date that has been calculated during forward pass calculation  negative total ﬂoat is caused when a constraint on the late dates is violated by duration and logic negative ﬂoat  analysis is a technique that helps to ﬁnd possible accelerated ways of bringing a delayed schedule back on track  schedule networks may have multiple nearcritical paths many software packages allow the user to deﬁne the  parameters used to determine the critical paths adjustments to activity durations when more resources or less  scope can be arranged logical relationships when the relationships were discretionary to begin with leads and  lags or other schedule constraints may be necessary to produce network paths with a zero or positive total ﬂoat  once the total ﬂoat and the free ﬂoat have been calculated the free ﬂoat is the amount of time that a schedule  activity can be delayed without delaying the early start date of any successor or violating a schedule constraint for  example the free ﬂoat for activity b in figure  is  days   critical path link noncritical path link activity node start finish a       c       b       d       activity name early start duration early finish late start total float late finish path a–b–d   path a–c–d   critical path key note this example uses the accepted convention of the project  starting on day  for calculating start and finish dates there are  other accepted conventions that may be used figure  example of critical path method, develop schedule,,vital way_of_life method_acting 
104, resource optimization,Has_Technics_Tools,resource optimization is used to adjust the start and ﬁnish dates of activities to adjust planned resource use to be  equal to or less than resource availability examples of resource optimization techniques that can be used to adjust the  schedule model due to demand and supply of resources include but are not limited to  resource leveling a technique in which start and ﬁnish dates are adjusted based on resource constraints with  the goal of balancing the demand for resources with the available supply resource leveling can be used when  shared or critically required resources are available only at certain times or in limited quantities or are over allocated such as when a resource has been assigned to two or more activities during the same time period as  shown in figure  or there is a need to keep resource usage at a constant level resource leveling can often  cause the original critical path to change available ﬂoat is used for leveling resources consequently the critical  path through the project schedule may change  resource smoothing a technique that adjusts the activities of a schedule model such that the requirements for  resources on the project do not exceed certain predeﬁned resource limits in resource smoothing as opposed to  resource leveling the project’s critical path is not changed and the completion date may not be delayed in other  words activities may only be delayed within their free and total ﬂoat resource smoothing may not be able to  optimize all resources     figure  resource leveling start activity a tom  hrs sue  hrs activity b sue  hrs activity c tom  hrs tom  hrs sue  hrs tom  hrs day  day  day  start activity a tom  hrs sue  hrs activity b sue  hrs activity c tom  hrs tom  hrs sue  hrs sue  hrs tom  hrs day  day  day  activities before resource leveling activities after resource leveling, develop schedule,,resourcefulness optimisation 
105, data analysis,Has_Technics_Tools,data analysis techniques that can be used for this process include but are not limited to  whatif scenario analysis whatif scenario analysis is the process of evaluating scenarios in order to predict  their effect positive or negative on project objectives this is an analysis of the question “what if the situation  represented by scenario happens” a schedule network analysis is performed using the schedule to compute  the different scenarios such as delaying a major component delivery extending speciﬁc engineering durations  or introducing external factors such as a strike or a change in the permit process the outcome of the whatif  scenario analysis can be used to assess the feasibility of the project schedule under different conditions and in  preparing schedule reserves and response plans to address the impact of unexpected situations  simulation simulation models the combined effects of individual project risks and other sources of uncertainty  to evaluate their potential impact on achieving project objectives the most common simulation technique is  monte carlo analysis see section  in which risks and other sources of uncertainty are used to calculate  possible schedule outcomes for the total project simulation involves calculating multiple work package durations  with different sets of activity assumptions constraints risks issues or scenarios using probability distributions  and other representations of uncertainty see section  figure  shows a probability distribution for a  project with the probability of achieving a certain target date ie project ﬁnish date in this example there is a   probability that the project will ﬁnish on or before the target date of may  while there is a  probability  of completing the project by may      project finish date                                        figure  example probability distribution of a target milestone for more information on how monte carlo simulation is used for schedule models see the practice standard  for scheduling, develop schedule,section 11.4.2.5,information psychoanalysis 
106, leads and lags,Has_Technics_Tools,  leads and lags are reﬁnements applied during network analysis to develop a viable  schedule by adjusting the start time of the successor activities leads are used in limited circumstances to advance a  successor activity with respect to the predecessor activity and lags are used in limited circumstances where processes  require a set period of time to elapse between the predecessors and successors without work or resource impact, develop schedule,section 6.3.2.3,lead slowdown 
